{
  "candidate_full": {
    "allowed": false,
    "blocking_rows": [
      "G05",
      "G10",
      "G13",
      "G15",
      "G18",
      "H3",
      "H4",
      "H7",
      "M3-03"
    ],
    "reason": "Required rows still open: M3-03 (production model-gateway credential rotation), G05/G10/G13 (same credential), G15/G18 with H3/H4 (DA-ENV-LSF and the single-bounded-attempt DA recipe gap); the declaration is final for this candidate and every open row is honestly recorded."
  },
  "checkpoints": [
    {
      "candidate": "5f3b867e49dcaee32c58b6d0266f5fdbb0360bc5",
      "evidence_kind": "aggregate",
      "evidence_level": "L0",
      "evidence_revision": "working-tree",
      "id": "M0-01a",
      "impact_globs": [
        "docs/reference/next-change/acp2-contracts/release/**",
        "scripts/acceptance/build_acp2_plan_graph.py",
        "scripts/acceptance/validate_acp2_gap_coverage.py",
        "tests/test_acp2_gap_coverage.py",
        "tests/test_acp2_plan_graph.py"
      ],
      "notes": "Baseline, plan graph and coverage ledger frozen; validator re-run at the candidate.",
      "owner": "INT",
      "parent": "M0-01",
      "receipt": "reports/acp2_remediation_20261026/m0-closeout.json",
      "receipt_sha256": "62a66785b4085fb47609fe5fe0ca6f491d81692872e60ad01b7c14d692dadeb6",
      "required_observations": {
        "baseline": "present",
        "coverage": "present"
      },
      "result": "PASS",
      "reuse": "exact",
      "status": "CLOSED"
    },
    {
      "candidate": "5f3b867e49dcaee32c58b6d0266f5fdbb0360bc5",
      "evidence_kind": "aggregate",
      "evidence_level": "L0",
      "evidence_revision": "working-tree",
      "id": "M0-01b",
      "impact_globs": [
        "docs/reference/next-change/acp2-contracts/release/**",
        "scripts/acceptance/build_acp2_plan_graph.py",
        "scripts/acceptance/validate_acp2_gap_coverage.py",
        "tests/test_acp2_gap_coverage.py",
        "tests/test_acp2_plan_graph.py"
      ],
      "notes": "B registered the release namespace as three planned contracts at M0-01; M5-02 flips them to delivered at B26.",
      "owner": "B",
      "parent": "M0-01",
      "receipt": "reports/acp2_remediation_20261026/m0-closeout.json",
      "receipt_sha256": "62a66785b4085fb47609fe5fe0ca6f491d81692872e60ad01b7c14d692dadeb6",
      "required_observations": {
        "manifest_registration": "present",
        "validator_tests": "present"
      },
      "result": "PASS",
      "reuse": "exact",
      "status": "CLOSED"
    },
    {
      "candidate": "5f3b867e49dcaee32c58b6d0266f5fdbb0360bc5",
      "evidence_kind": "fixture",
      "evidence_level": "L1",
      "evidence_revision": "e59ce7f2f8c7dbcf2277c27223495c5b7bce3c8a",
      "id": "M0-02a",
      "impact_globs": [
        ".github/workflows/ci.yml",
        "tests/test_frontend_module_tests_gate.py"
      ],
      "notes": "CI matrix, RPH package job, frontend module tests and wall-clock rules landed.",
      "owner": "INT",
      "parent": "M0-02",
      "receipt": "reports/acp2_remediation_20261026/m0-02a-local-toolchain.json",
      "receipt_sha256": "031748ccae7e7c46d32fb965737240111dc570d6a854455c20f8ecb383ffa6a1",
      "required_observations": {
        "ci_matrix": "present",
        "toolchain": "present"
      },
      "result": "PASS",
      "reuse": "exact",
      "status": "CLOSED"
    },
    {
      "candidate": "5f3b867e49dcaee32c58b6d0266f5fdbb0360bc5",
      "evidence_kind": "fixture",
      "evidence_level": "L1",
      "evidence_revision": "e59ce7f2f8c7dbcf2277c27223495c5b7bce3c8a",
      "id": "M0-02b",
      "impact_globs": [
        ".github/workflows/ci.yml",
        "tests/test_frontend_module_tests_gate.py"
      ],
      "notes": "mcp-conformance owns -m contract with JUnit skip accounting and DSH_DECLARED_BUT_UNRESOLVED.",
      "owner": "INT + B + C-RPH",
      "parent": "M0-02",
      "receipt": ".github/workflows/ci.yml",
      "receipt_sha256": "64d04b8dca6e7dd3ef2eff53513f0083c026f96ec0d9342697e4afcd14a1237b",
      "required_observations": {
        "contract_lane": "present",
        "dsh_declaration": "present",
        "junit_accounting": "present"
      },
      "result": "PASS",
      "reuse": "exact",
      "status": "CLOSED"
    },
    {
      "candidate": "5f3b867e49dcaee32c58b6d0266f5fdbb0360bc5",
      "evidence_kind": "fixture",
      "evidence_level": "L1",
      "evidence_revision": "5f3b867e49dcaee32c58b6d0266f5fdbb0360bc5",
      "id": "M0-02c",
      "impact_globs": [
        ".github/workflows/ci.yml",
        "tests/test_frontend_module_tests_gate.py"
      ],
      "notes": "Ruff 0.15.22 hygiene/ratchet is still pending. D-INT-06 freezes it out of the G01-G26 required chain: it cannot close or keep open any gap and is not a candidate_full blocker.",
      "owner": "INT",
      "parent": "M0-02",
      "receipt": "reports/acp2_remediation_20261026/m0-closeout.json",
      "receipt_sha256": "62a66785b4085fb47609fe5fe0ca6f491d81692872e60ad01b7c14d692dadeb6",
      "required_observations": {
        "required_chain": "absent",
        "ruff_ratchet": "absent"
      },
      "result": "NOT_VERIFIED",
      "reuse": "rerun_required",
      "status": "OPEN"
    },
    {
      "candidate": "5f3b867e49dcaee32c58b6d0266f5fdbb0360bc5",
      "evidence_kind": "fixture",
      "evidence_level": "L1",
      "evidence_revision": "3663d54708503e55a606fb9cf07c14c2e160d6c0",
      "id": "M0-03a",
      "impact_globs": [
        "scripts/acceptance/acp2_runtime.py",
        "scripts/acceptance/acp2_experience.py",
        "tests/test_acp2_runtime_acceptance_harness.py",
        "tests/test_acp2_experience_observations.py"
      ],
      "notes": "B runtime evidence labels and required-observation enforcement.",
      "owner": "B",
      "parent": "M0-03",
      "receipt": "tests/test_acp2_runtime_acceptance_harness.py",
      "receipt_sha256": "ac083deb310319f8e74b098864d3730217ebddb7ee0dc48ab028be1ea4b8157f",
      "required_observations": {
        "evidence_labels": "present",
        "required_observations": "present"
      },
      "result": "PASS",
      "reuse": "reused",
      "status": "CLOSED"
    },
    {
      "candidate": "5f3b867e49dcaee32c58b6d0266f5fdbb0360bc5",
      "evidence_kind": "fixture",
      "evidence_level": "L1",
      "evidence_revision": "3663d54708503e55a606fb9cf07c14c2e160d6c0",
      "id": "M0-03b",
      "impact_globs": [
        "scripts/acceptance/acp2_runtime.py",
        "scripts/acceptance/acp2_experience.py",
        "tests/test_acp2_runtime_acceptance_harness.py",
        "tests/test_acp2_experience_observations.py"
      ],
      "notes": "C experience/live harness labels and static live-port probes; no live row is upgraded by a probe.",
      "owner": "C-RPH",
      "parent": "M0-03",
      "receipt": "reports/acp2_remediation_20261026/m0-03b-live-observations.json",
      "receipt_sha256": "b960cf19b1f1a2b65748ef7abd40c9b00bf64e5e08011ed38911a0ca2f4a0723",
      "required_observations": {
        "experience_harness": "present",
        "live_port_probe": "present"
      },
      "result": "PASS",
      "reuse": "reused",
      "status": "CLOSED"
    },
    {
      "candidate": "5f3b867e49dcaee32c58b6d0266f5fdbb0360bc5",
      "evidence_kind": "fixture",
      "evidence_level": "L1",
      "evidence_revision": "3663d54708503e55a606fb9cf07c14c2e160d6c0",
      "id": "M0-03c",
      "impact_globs": [
        "scripts/acceptance/acp2_runtime.py",
        "scripts/acceptance/acp2_experience.py",
        "tests/test_acp2_runtime_acceptance_harness.py",
        "tests/test_acp2_experience_observations.py"
      ],
      "notes": "INT/REL BOM/coverage skeleton reached the M5-01 durable store; M5-02 rebuilds it from the clean candidate.",
      "owner": "INT/REL",
      "parent": "M0-03",
      "receipt": "reports/acp2_remediation_20261026/m5-01/summary.json",
      "receipt_sha256": "03414b0b12e1626f6e9e9a7e43771b530814f069ccd3090a5bdf183df4c007d2",
      "required_observations": {
        "artifact_store": "present",
        "bom": "present",
        "coverage": "present"
      },
      "result": "PASS",
      "reuse": "exact",
      "status": "CLOSED"
    },
    {
      "candidate": "5f3b867e49dcaee32c58b6d0266f5fdbb0360bc5",
      "evidence_kind": "fixture",
      "evidence_level": "L1",
      "evidence_revision": "7959bf88ea5a583340bf575c44039b892cffd40d",
      "id": "M1-01a",
      "impact_globs": [
        "docs/reference/next-change/acp2-contracts/runtime/application-api.v1.json",
        "docs/reference/next-change/acp2-contracts/runtime/science-binding.v1.json",
        "docs/reference/next-change/acp2-contracts/runtime/control-and-data.v1.json",
        "src/acp_services/entrypoints/mcp.py"
      ],
      "notes": "Extension negotiation/version axis frozen and consumed.",
      "owner": "B",
      "parent": "M1-01",
      "receipt": "tests/test_acp2_runtime_contracts.py",
      "receipt_sha256": "496fb56751f8b7fb2dbb987c951dff4e757a68ac893476f8f4bd45af6a88e707",
      "required_observations": {
        "negotiation": "present",
        "version_axis": "present"
      },
      "result": "PASS",
      "reuse": "reused",
      "status": "CLOSED"
    },
    {
      "candidate": "5f3b867e49dcaee32c58b6d0266f5fdbb0360bc5",
      "evidence_kind": "fixture",
      "evidence_level": "L1",
      "evidence_revision": "7959bf88ea5a583340bf575c44039b892cffd40d",
      "id": "M1-01b",
      "impact_globs": [
        "docs/reference/next-change/acp2-contracts/runtime/application-api.v1.json",
        "docs/reference/next-change/acp2-contracts/runtime/science-binding.v1.json",
        "docs/reference/next-change/acp2-contracts/runtime/control-and-data.v1.json",
        "src/acp_services/entrypoints/mcp.py"
      ],
      "notes": "Operation/artifact/status schemas with one table per tool and three readers.",
      "owner": "B",
      "parent": "M1-01",
      "receipt": "tests/test_acp2_runtime_contracts.py",